Sheet: Лист1
A1: Сосновый | B1: 1 | C1: 1 | D1: 1 | E1: =CONCAT("s","_",RC[-3],"_",RC[-2],"_",RC[-1],".jpg") -> s_1_1_1.jpg | F1: 6000000 | G1: 2 | H1: 65 | I1: 1 | J1: 1 | K1: 1 | L1: 0 | M1: 0 | N1: 1 | O1: 0 | P1: 0 | Q1: 1 | R1: 1
A2: Сосновый | B2: 1 | C2: 1 | D2: =R[-1]C+1 -> 2 | E2: =CONCAT("s","_",RC[-3],"_",RC[-2],"_",RC[-1],".jpg") -> s_1_1_2.jpg | F2: 26000000 | G2: 1 | H2: 250 | I2: 0 | J2: 0 | K2: 0 | L2: 0 | M2: 0 | N2: 0 | O2: 0 | P2: 1 | Q2: 1 | R2: 1
A3: Сосновый | B3: 1 | C3: 1 | D3: =R[-1]C+1 -> 3 | E3: =CONCAT("s","_",RC[-3],"_",RC[-2],"_",RC[-1],".jpg") -> s_1_1_3.jpg | F3: 6000000 | G3: 2 | H3: 65 | I3: 1 | J3: 1 | K3: 1 | L3: 0 | M3: 0 | N3: 1 | O3: 0 | P3: 0 | Q3: 1 | R3: 1
A4: Сосновый | B4: 1 | C4: 1 | D4: =R[-1]C+1 -> 4 | E4: =CONCAT("s","_",RC[-3],"_",RC[-2],"_",RC[-1],".jpg") -> s_1_1_4.jpg | F4: 6000000 | G4: 2 | H4: 65 | I4: 1 | J4: 1 | K4: 1 | L4: 0 | M4: 0 | N4: 0 | O4: 0 | P4: 0 | Q4: =R[-3]C+1 -> 2 | R4: 1
A5: Сосновый | B5: 1 | C5: 1 | D5: =R[-1]C+1 -> 5 | E5: =CONCAT("s","_",RC[-3],"_",RC[-2],"_",RC[-1],".jpg") -> s_1_1_5.jpg | F5: 6000000 | G5: 1 | H5: 25 | I5: 0 | J5: 0 | K5: 0 | L5: 0 | M5: 0 | N5: 0 | O5: 1 | P5: 0 | Q5: =R[-3]C+1 -> 2 | R5: =R[-4]C+1 -> 2
A6: Сосновый | B6: 1 | C6: 1 | D6: =R[-1]C+1 -> 6 | E6: =CONCAT("s","_",RC[-3],"_",RC[-2],"_",RC[-1],".jpg") -> s_1_1_6.jpg | F6: 6000000 | G6: 1 | H6: 25 | I6: 0 | J6: 0 | K6: 0 | L6: 0 | M6: 0 | N6: 0 | O6: 1 | P6: 0 | Q6: =R[-3]C+1 -> 2 | R6: =R[-4]C+1 -> 2
A7: Сосновый | B7: 1 | C7: 1 | D7: =R[-1]C+1 -> 7 | E7: =CONCAT("s","_",RC[-3],"_",RC[-2],"_",RC[-1],".jpg") -> s_1_1_7.jpg | F7: 6000000 | G7: 1 | H7: 25 | I7: 0 | J7: 0 | K7: 0 | L7: 0 | M7: 0 | N7: 0 | O7: 1 | P7: 0 | Q7: =R[-3]C+1 -> 3 | R7: =R[-4]C+1 -> 2
A8: Сосновый | B8: 1 | C8: 1 | D8: =R[-1]C+1 -> 8 | E8: =CONCAT("s","_",RC[-3],"_",RC[-2],"_",RC[-1],".jpg") -> s_1_1_8.jpg | F8: 6000000 | G8: 2 | H8: 65 | I8: 0 | J8: 0 | K8: 1 | L8: 0 | M8: 1 | N8: 1 | O8: 0 | P8: 0 | Q8: =R[-3]C+1 -> 3 | R8: =R[-4]C+1 -> 2
A9: Сосновый | B9: 1 | C9: 1 | D9: =R[-1]C+1 -> 9 | E9: =CONCAT("s","_",RC[-3],"_",RC[-2],"_",RC[-1],".jpg") -> s_1_1_9.jpg | F9: 6000000 | G9: 2 | H9: 65 | I9: 0 | J9: 0 | K9: 1 | L9: 1 | M9: 1 | N9: 1 | O9: 0 | P9: 0 | Q9: =R[-3]C+1 -> 3 | R9: 1
A10: Сосновый | B10: 1 | C10: 1 | D10: =R[-1]C+1 -> 10 | E10: =CONCAT("s","_",RC[-3],"_",RC[-2],"_",RC[-1],".jpg") -> s_1_1_10.jpg | F10: 6000000 | G10: 2 | H10: 65 | I10: 1 | J10: 0 | K10: 1 | L10: 0 | M10: 1 | N10: 1 | O10: 0 | P10: 0 | Q10: =R[-3]C+1 -> 4 | R10: 1
A11: Сосновый | B11: 1 | C11: =R[-10]C+1 -> 2 | D11: =R[-1]C+1 -> 11 | E11: =CONCAT("s","_",RC[-3],"_",RC[-2],"_",RC[-1],".jpg") -> s_1_2_11.jpg | F11: 6000000 | G11: 2 | H11: 65 | I11: 1 | J11: 0 | K11: 0 | L11: 0 | M11: 0 | N11: 1 | O11: 0 | P11: 0 | Q11: =R[-3]C+1 -> 4 | R11: 1
A12: Сосновый | B12: 1 | C12: =R[-10]C+1 -> 2 | D12: =R[-1]C+1 -> 12 | E12: =CONCAT("s","_",RC[-3],"_",RC[-2],"_",RC[-1],".jpg") -> s_1_2_12.jpg | F12: 6000000 | G12: 2 | H12: 65 | I12: 1 | J12: 1 | K12: 0 | L12: 0 | M12: 1 | N12: 1 | O12: 0 | P12: 0 | Q12: =R[-3]C+1 -> 4 | R12: 1
A13: Сосновый | B13: 1 | C13: =R[-10]C+1 -> 2 | D13: =R[-1]C+1 -> 13 | E13: =CONCAT("s","_",RC[-3],"_",RC[-2],"_",RC[-1],".jpg") -> s_1_2_13.jpg | F13: 6000000 | G13: 1 | H13: 25 | I13: 0 | J13: 0 | K13: 0 | L13: 0 | M13: 0 | N13: 0 | O13: 1 | P13: 0 | Q13: 1 | R13: =R[-4]C+1 -> 2
A14: Сосновый | B14: 1 | C14: =R[-10]C+1 -> 2 | D14: =R[-1]C+1 -> 14 | E14: =CONCAT("s","_",RC[-3],"_",RC[-2],"_",RC[-1],".jpg") -> s_1_2_14.jpg | F14: 6000000 | G14: 1 | H14: 25 | I14: 0 | J14: 0 | K14: 0 | L14: 0 | M14: 0 | N14: 0 | O14: 1 | P14: 0 | Q14: 1 | R14: =R[-4]C+1 -> 2
A15: Сосновый | B15: 1 | C15: =R[-10]C+1 -> 2 | D15: =R[-1]C+1 -> 15 | E15: =CONCAT("s","_",RC[-3],"_",RC[-2],"_",RC[-1],".jpg") -> s_1_2_15.jpg | F15: 6000000 | G15: 1 | H15: 25 | I15: 0 | J15: 0 | K15: 0 | L15: 0 | M15: 0 | N15: 0 | O15: 1 | P15: 0 | Q15: 1 | R15: =R[-4]C+1 -> 2
A16: Сосновый | B16: 1 | C16: =R[-10]C+1 -> 2 | D16: =R[-1]C+1 -> 16 | E16: =CONCAT("s","_",RC[-3],"_",RC[-2],"_",RC[-1],".jpg") -> s_1_2_16.jpg | F16: 6000000 | G16: 2 | H16: 65 | I16: 1 | J16: 1 | K16: 1 | L16: 1 | M16: 0 | N16: 0 | O16: 0 | P16: 0 | Q16: =R[-3]C+1 -> 2 | R16: =R[-4]C+1 -> 2
A17: Сосновый | B17: 1 | C17: =R[-10]C+1 -> 2 | D17: =R[-1]C+1 -> 17 | E17: =CONCAT("s","_",RC[-3],"_",RC[-2],"_",RC[-1],".jpg") -> s_1_2_17.jpg | F17: 6000000 | G17: 2 | H17: 65 | I17: 1 | J17: 1 | K17: 1 | L17: 0 | M17: 0 | N17: 0 | O17: 0 | P17: 0 | Q17: =R[-3]C+1 -> 2 | R17: 1
A18: Сосновый | B18: 1 | C18: =R[-10]C+1 -> 2 | D18: =R[-1]C+1 -> 18 | E18: =CONCAT("s","_",RC[-3],"_",RC[-2],"_",RC[-1],".jpg") -> s_1_2_18.jpg | F18: 6000000 | G18: 2 | H18: 65 | I18: 1 | J18: 1 | K18: 1 | L18: 1 | M18: 0 | N18: 1 | O18: 0 | P18: 0 | Q18: =R[-3]C+1 -> 2 | R18: 1
A19: Сосновый | B19: 1 | C19: =R[-10]C+1 -> 2 | D19: =R[-1]C+1 -> 19 | E19: =CONCAT("s","_",RC[-3],"_",RC[-2],"_",RC[-1],".jpg") -> s_1_2_19.jpg | F19: 26000000 | G19: 1 | H19: 250 | I19: 0 | J19: 0 | K19: 0 | L19: 0 | M19: 0 | N19: 0 | O19: 0 | P19: 1 | Q19: 1 | R19: 2
A20: Сосновый | B20: =R[-19]C+1 -> 2 | C20: 1 | D20: 1 | E20: =CONCAT("s","_",RC[-3],"_",RC[-2],"_",RC[-1],".jpg") -> s_2_1_1.jpg | F20: 6000000 | G20: 2 | H20: 65 | I20: 1 | J20: 1 | K20: 1 | L20: 0 | M20: 0 | N20: 1 | O20: 0 | P20: 0 | Q20: =R[-3]C+1 -> 3 | R20: 1